PECC-LN,江西永方电源有限公司，在江西省环境质量信息发布平台上数据显示，其COD数据间断性超标排放，请 @环保部发布 关注，请 @江西环保 @抚州市环境保护 给予说明。 @绿色江南公众环境关注中心 @蔚蓝地图#蔚蓝地图# @PECC-LiJ ​,0,0,1,2016-11-29 17:12:42,https://weibo.cn/comment/EjNQv8LhF?uid=5907562386&rl=1#cmtfrm,江西永方电源,,,,@环保部发布,@江西环保,@抚州市环境保护,@绿色江南公众环境关注中心,@蔚蓝地图,2
新浪山东菏泽频道,#菏泽身边事#2月19日，@青岛啤酒 菏泽大区2016春季订货会召开。来自菏泽八县三区的经销商纷纷抢订青啤新品及崂山\纯生\山水经典系列，并举行现场抽奖，金猴大吉！@菏泽事儿 @菏泽市旅游局官方微博 @百姓天天看 菏泽·吴店镇 ​,4,1,3,2016-02-19 10:20:19,https://weibo.cn/comment/DixepfHpT?uid=5065242068&rl=1#cmtfrm,青岛啤酒（菏泽）,,,,@青岛啤酒,@菏泽事儿,@菏泽市旅游局官方微博,@百姓天天看,1
庄里微,【#石家庄身边事#数据是红的，河流也是红的】@绿行太行 :对于多次举报仍排污超标的辛集市水处理中心，志愿者近日对该地区进行了实地调查，发现水质状况不容乐观，现场12369举报，工作人员表示仍需核实超标情况，希望@辛集环保 环保部门尽快将调查核实情况公布！@蔚蓝地图 ​,10,12,61,2016-11-09 10:32:04,https://weibo.cn/comment/EgIFX6bcd?uid=1629898120&rl=1#cmtfrm,辛集市水处理中心,,,,@绿行太行,@辛集环保,@蔚蓝地图,1
石家庄帮忙,#石家庄身边事#【数据是红的，河流也是红的】@绿行太行 :对于多次举报仍排污超标的辛集市水处理中心，志愿者近日对该地区进行了实地调查，发现水质状况不容乐观，现场12369举报，工作人员表示仍需核实超标情况，希望@辛集环保 环保部门尽快将调查核实情况公布！@蔚蓝地图(庄里微) ​,0,0,1,2016-11-09 11:47:26,https://weibo.cn/comment/EgJayblj2?uid=2781512687&rl=1#cmtfrm,辛集市水处理中心,,,,@绿行太行,@辛集环保,@蔚蓝地图,1
庄里微,【#石家庄身边事#数据是红的，河流也是红的】@绿行太行 :对于多次举报仍排污超标的辛集市水处理中心，志愿者近日对该地区进行了实地调查，发现水质状况不容乐观，现场12369举报，工作人员表示仍需核实超标情况，希望@辛集环保 环保部门尽快将调查核实情况公布！@蔚蓝地图 ​,10,12,61,2016-11-09 10:32:04,https://weibo.cn/comment/EgIFX6bcd?uid=1629898120&rl=1#cmtfrm,辛集市水处理中心,,,,@绿行太行,@辛集环保,@蔚蓝地图,1
绿行太行,#SEE卫蓝侠# #蔚蓝地图# 对于多次举报仍排污超标的辛集市水处理中心，志愿者近日对该地区进行了实地调查，发现水质状况不容乐观，现场12369举报，工作人员表示仍需核实超标情况，希望@辛集环保 环保部门尽快将调查核实情况公布！@SEE创绿家 @蔚蓝地图 @河北电视台今日资讯 @公众环境马军 ​,4,3,29,2016-11-09 09:55:10,https://weibo.cn/comment/EgIqYqq91?uid=5848325113&rl=1#cmtfrm,辛集市水处理中心,,,,@辛集环保,@蔚蓝地图,@河北电视台今日资讯,@公众环境马军,1
石家庄帮忙,#石家庄身边事#【数据是红的，河流也是红的】@绿行太行 :对于多次举报仍排污超标的辛集市水处理中心，志愿者近日对该地区进行了实地调查，发现水质状况不容乐观，现场12369举报，工作人员表示仍需核实超标情况，希望@辛集环保 环保部门尽快将调查核实情况公布！@蔚蓝地图(庄里微) ​,0,0,1,2016-11-09 11:47:26,https://weibo.cn/comment/EgJayblj2?uid=2781512687&rl=1#cmtfrm,辛集市水处理中心,,,,@绿行太行,@辛集环保,@蔚蓝地图,1
庄里微,【#石家庄身边事#数据是红的，河流也是红的】@绿行太行 :对于多次举报仍排污超标的辛集市水处理中心，志愿者近日对该地区进行了实地调查，发现水质状况不容乐观，现场12369举报，工作人员表示仍需核实超标情况，希望@辛集环保 环保部门尽快将调查核实情况公布！@蔚蓝地图 ​,10,12,61,2016-11-09 10:32:04,https://weibo.cn/comment/EgIFX6bcd?uid=1629898120&rl=1#cmtfrm,辛集市水处理中心,,,,@绿行太行,@辛集环保,@蔚蓝地图,1
绿行太行,#SEE卫蓝侠# #蔚蓝地图# 对于多次举报仍排污超标的辛集市水处理中心，志愿者近日对该地区进行了实地调查，发现水质状况不容乐观，现场12369举报，工作人员表示仍需核实超标情况，希望@辛集环保 环保部门尽快将调查核实情况公布！@SEE创绿家 @蔚蓝地图 @河北电视台今日资讯 @公众环境马军 ​,4,3,29,2016-11-09 09:55:10,https://weibo.cn/comment/EgIqYqq91?uid=5848325113&rl=1#cmtfrm,辛集市水处理中心,,,,@辛集环保,@蔚蓝地图,@河北电视台今日资讯,@公众环境马军,1
蔚蓝地图,集市水处理中心在线监测数据，显示近一月来，超过80%天数排放不达标。希望排放浓度高的企业作出公开说明！2016年11月03日12点#蔚蓝地图# @辛集环保 @绿行太行 http://t.cn/RVeUWjr ​,0,2,15,2016-11-03 15:12:01,https://weibo.cn/comment/EfOL8oFBs?rl=1#cmtfrm,辛集市水处理中心,1,山东言中,转发理由:希望排放浓度高的辛集市水处理中心作出公开说明！@河北省环保厅 @环境与生活-河北 @河北环境权益保护中心 //@绿行太行:#蔚蓝地图#该污水处理厂长期排污超标，上次处理之后，未见明显好转，望加大治理力度@辛集环保 @蔚蓝地图      ,@辛集环保,@绿行太行,@河北省环保厅,@环境与生活-河北,@河北环境权益保护中心,@绿行太行,@辛集环保,@蔚蓝地图,2
山东言中,辛集市水处理中心在线监测数据，显示近一月来，超过80%天数排放不达标。希望排放浓度高的企业作出公开说明！2016年11月03日12点#蔚蓝地图# @辛集环保 @绿行太行 http://t.cn/RVeUWjr ​,1,2,17,2016-11-03 12:11:01,https://weibo.cn/comment/EfOL8oFBs?uid=2945014761&rl=1#cmtfrm,辛集市水处理中心,,,,@辛集环保,@绿行太行,1
闲月野叟,第八轮中美战略经济对话开幕式上美财长批评中国产能过剩，我现在就以钢铁为例证明//@美国驻华大使馆 没有炒作，是实实在在的过剩。大同市古店镇大同煤矿集团天建钢铁厂，如果这都不是产能过剩和污染环境，那么以往河北等省市所有拆除的小钢厂都不是过剩产能也没有污染环境。//@中国政府网 @FT中文网 ​,0,0,0,2016-06-08 14:47:21,https://weibo.cn/comment/DzhZqipci?uid=2092298824&rl=1#cmtfrm,大同煤矿天建钢铁,,,,@美国驻华大使馆,@中国政府网,1
刘润哲_木mu,新疆准东油田西部，有很多大企业，有甘泉堡工业园，比如特变电工硅业等，他们白天排污就很严重，晚上更严重，准东油田环境恶化到不能轻易开窗，开窗就可以发现家里有黑色小颗粒。请有关部门对他们进行监管。之前很多人上报新疆相关部门，但是依然没有任何变化。请媒体朋友帮忙。@爆料一姐 @地球都哭了 @腾讯新闻客户端 @乌鲁木齐市环保局 @中国环境新闻 @中国城市空气污染排行 @中国环境报 @头条新闻 @界面 @古丽娜扎 @李咏 http://t.cn/R2Wi94u,1,1,2,2016-11-14 22:27:56,https://weibo.cn/comment/Ehyv0iZs8?uid=1763679070&rl=1#cmtfrm,特变电工新疆硅业,,,,@爆料一姐,@地球都哭了,@腾讯新闻客户端,@乌鲁木齐市环保局,@中国环境新闻,@中国城市空气污染排行,@中国环境报,@头条新闻,@界面,@古丽娜扎,@李咏,1
丽江古城警方,【110减负】发现自来水网管漏水、爆裂、消防栓损坏等情况的，请联系丽江市供排水公司（值班电话：5126188）抢修。@云南丽江警方 丽江·束河街区 ​,1,0,0,2016-07-06 16:46:45,https://weibo.cn/comment/DDyJNdJ00?uid=3212587784&rl=1#cmtfrm,丽江供排水,,,,@云南丽江警方,1
最爱自己的小冰,维达餐巾纸有蚊子标本，我就想知道维达的生产流程是怎样的，为什么会出现如此标本？维达纸业作为纸品行业销售最大的企业如何保证纸张的卫生安全？销售量节节攀升的同时，质量如何得到保障？@维达Vinda @广东省工商局 @中国消费者投诉网官网 ​,1,1,0,2016-11-14 17:00:12,https://weibo.cn/comment/EhwlYAEiF?uid=5533790920&rl=1#cmtfrm,维达纸业（中国）,,,,@维达Vinda,@广东省工商局,@中国消费者投诉网官网,1
青海V联盟,"【体育快讯】2016首届“天佑德青稞酒杯”业余山地自行车越野邀请赛落下帷幕！6月19日，由互助县人民政府、青海省自行车运动协会、青海互助青稞酒股份有限公司共同主办的2016首届""天佑德青稞酒""杯业余山地自行车越野邀请赛在互助激情开赛。摄/[c]V联盟  @环湖赛 @青青稞酒002646 @青海TYD洲际自行车队 @我是吴生君 @QH张煜 @西宁体育 @青体赛事",1,0,3,2016-06-19 19:37:13,https://weibo.cn/comment/DAZAxBbVC?uid=2824221090&rl=1#cmtfrm,青海互助青稞酒股份,,,,@环湖赛,@青青稞酒002646,@青海TYD洲际自行车队,@我是吴生君,@西宁体育,@青体赛事,1
抒一纸时光,#山东空气观察#2016年12月02日10点，荣成市热电厂在线监测数据，希望排放浓度高的企业作出公开说明！@荣成环境 @蔚蓝地图 @绿行齐鲁 #蔚蓝地图# http://t.cn/RfEuGNx ​,0,0,0,2016-12-02 10:27:10,https://weibo.cn/comment/EkdtnDegM?uid=3179790384&rl=1#cmtfrm,荣成市热电厂,,,,@荣成环境,@蔚蓝地图,@绿行齐鲁,1
菏泽巨野县法院,#案例说法#【吴庆模等19244名蔗农追索蔗款纠纷案】广西永凯糖纸集团有限责任公司宾阳大桥分公司等拖欠蔗农甘蔗款2.5亿元，被依法强制执行，蔗农甘蔗款全部执行到位。@隋彭生民商法 @潍坊市中级人民法院 @青村法宣 @高密普法 @武法快线 @牡丹江市中级法院 @无讼永安 @宁阳法院 @玉溪峨山小街人民调委会 @阳泉城区法院 @西渡法宣,7,8,14,2016-04-01 10:01:27,https://weibo.cn/comment/DoV3C30e4?uid=2359162503&rl=1#cmtfrm,广西永凯糖纸,,,,@隋彭生民商法,@潍坊市中级人民法院,@青村法宣,@高密普法,@武法快线,@牡丹江市中级法院,@无讼永安,@宁阳法院,@玉溪峨山小街人民调委会,@阳泉城区法院,@西渡法宣,3
Mr-Lee栗先生,@淮南帮 @淮南发布 @首创水务 就淮南这水质怎么好意思让我们交钱的？！ ​,0,0,0,2016-03-01 16:22:04,https://weibo.cn/comment/DkfiI8jHc?uid=1429661300&rl=1#cmtfrm,淮南首创水务,,,,@淮南帮,@淮南发布,@首创水务,1
搬家送货快运15156647300,田区上湖社区停水几天了到现在没水，快过年了能抓紧维修吗？@淮南帮 @淮南发布 @ 淮南首创水务 ​,0,0,0,2016-01-30 17:41:17,https://weibo.cn/comment/DfxztyOf0?uid=1980884930&rl=1#cmtfrm,淮南首创水务,,,,@淮南帮,@淮南发布,1
搬家送货快运15156647300,田区上湖社区停水几天了到现在没水，快过年了能抓紧维修吗？@淮南帮 @淮南发布 @ 淮南首创水务 ​,0,0,0,2016-01-30 17:34:06,https://weibo.cn/comment/Dfxwyp9Py?uid=1980884930&rl=1#cmtfrm,淮南首创水务,,,,@淮南帮,@淮南发布,1
记忆凌乱丶忧伤,天气寒冷，水管冻炸了。打淮南首创水务局服务电话和一直占线没人接。好不容易打通了说派人来修，一直没来人。然后所有电话就一直打不通。天气冷，结冰了，年龄大的老年人滑到了怎么办。真是无奈@淮南电视台今晚800@淮南市城市管理行政执法局 ​,0,0,0,2016-01-25 18:21:31,https://weibo.cn/comment/DeMHjD9na?uid=2312847662&rl=1#cmtfrm,淮南首创水务,,,,@淮南电视台今晚800,@淮南市城市管理行政执法局,1
同呼吸共环保,潍坊：一企业环保数据造假被查】日前，省环保厅独立调查工作人员发现，上实环境城西(潍坊)污水处理公司将采样泵和采样管放入水桶中，并注入外接自来水，干扰设备采样。目前，@潍坊公安 对该公司厂长方某及案件实施者于某分别给予10天和7天的行政拘留，@潍坊环保 对该公司罚款10万元，追缴当月超标排污费6.3万元。http://t.cn/RtRx2Ff,1,11,0,2016-08-18 12:35:52,https://weibo.cn/comment/E45vUijPu?rl=1#cmtfrm,上实环境水务股份,1,山东环境,转发理由:上市企业造假，真想不到！真不应该！上实环境水务股份有限公司（简称上实环境水务）是上海实业环境控股有限公司(新加坡交易所主板上市公司，股票代码：5GB-SG) 投资控股的外商投资股份制企业，为上海实业集团成员企业。      ,@潍坊公安,@潍坊环保,2
同呼吸共环保,动监测设备弄虚作假，上实环境潍坊一污水处理企业被处罚，责任人被拘留，按法规处罚10万不多，但拘留责任人特别是媒体通报，对于一个上市公司就是最严厉处罚。自动监测设备弄虚作假 潍坊一污水处理企业被罚10万元 ​,2,0,1,2016-08-17 08:45:53,https://weibo.cn/comment/E3W4aD3He?rl=1#cmtfrm,上实环境水务股份,1,同呼吸共环保,,@山东环境,@绿行齐鲁,@蔚蓝地图,@豫鲁风骨,@求是2013,@监测小达人,1
陇南武都发布,#聚焦徽县苗木节会##发展苗木产业•助推精准扶贫##做强优势富民产业•打造中国苗木之乡#【苗木节观摩点—甘肃徽县宏泰实业有限公司苗木基地】该公司投资3000万元把苗木基地建设成为集苗木繁育、生态养殖、休闲观光于一体的农业综合开发项目。@陇南林业@陇南徽县发布 ​,8,10,40,2016-09-09 16:28:33,https://weibo.cn/comment/E7tWmgONm?uid=2706533745&rl=1#cmtfrm,甘肃徽县宏泰实业,,,,@陇南林业,@陇南徽县发布,1
陇南日报,#聚焦徽县苗木节会##发展苗木产业•助推精准扶贫##做强优势富民产业•打造中国苗木之乡#【苗木节观摩点—甘肃徽县宏泰实业有限公司苗木基地】该公司投资3000万元把苗木基地建设成为集苗木繁育、生态养殖、休闲观光于一体的农业综合开发项目。@陇南林业@陇南徽县发布 ​,1,0,8,2016-09-09 10:46:03,https://weibo.cn/comment/E7rHl3UvI?uid=3230317920&rl=1#cmtfrm,甘肃徽县宏泰实业,,,,@陇南林业,@陇南徽县发布,1
陇南发布,#聚焦徽县苗木节会##发展苗木产业•助推精准扶贫##做强优势富民产业•打造中国苗木之乡#【苗木节观摩点—甘肃徽县宏泰实业有限公司苗木基地】该公司投资3000万元把苗木基地建设成为集苗木繁育、生态养殖、休闲观光于一体的农业综合开发项目。@陇南林业@陇南徽县发布 ​,16,17,190,2016-09-09 09:12:18,https://weibo.cn/comment/E7r5hza32?uid=2626472827&rl=1#cmtfrm,甘肃徽县宏泰实业,,,,@陇南林业,@陇南徽县发布,1
爱吃螃蟹的虾米,2016年07月20日10时，杭州丰达纸业有限公司在线监测数据，希望排放浓度高的企业作出公开说明！#蔚蓝地图#@浙江环保 ​,0,0,0,2016-07-20 10:59:35,https://weibo.cn/comment/DFErPo3VR?uid=1793034901&rl=1#cmtfrm,杭州丰达纸业,,,,@浙江环保,1
Lin林艺恩,山东大宇造船海洋（山东）有限公司！！！经常进行漏天打磨喷漆.......以后会陆续报道@水母网 @胶东在线 @今日烟台 @齐鲁晚报 @央视新闻 @烟台环境 @烟台市头条新闻 @山东环境 ​,0,2,0,2016-08-05 08:33:10,https://weibo.cn/comment/E26S1hJQD?uid=5310109120&rl=1#cmtfrm,大宇造船海洋（山东）,,,,@水母网,@胶东在线,@今日烟台,@齐鲁晚报,@央视新闻,@烟台环境,@烟台市头条新闻,@山东环境,2
陇南文县发布,#陇上江南魅力文县# #精准扶贫看文县# 【全市2016年度电、焊、钳及中控操作技能大赛在文县成功举办】6月7日至8日，由陇南市总工会主办、文县总红会承办的陇南市2016年度电、焊、钳及中控操作技能大赛在文县祁连山水泥厂成功举办。@甘肃发布@陇南发布@陇南日报@陇南旅游@乡野隐士_18 ​,6,3,21,2016-06-12 09:39:16,https://weibo.cn/comment/DzRGmho93?uid=3349858042&rl=1#cmtfrm,文县祁连山水泥,,,,@甘肃发布,@陇南发布,@陇南日报,@陇南旅游,@乡野隐士_18,1
呢喃lucky,娜红玫瑰：近日违法收售药贩子猖獗，在南开区汶水路上，每天晚上10点后，上百余药贩子将该条马路围的水泄不通，道路两旁都停着他们的私家车，不仅影响道路交通畅通，还严重妨碍周围居民的生活和安全，希望我市有关部门能联合出击，打掉这一违法行为！@都市报道60分 ​,0,24,0,2016-04-21 11:32:15,https://weibo.cn/comment/DrTeUAXjB?rl=1#cmtfrm,天津北方食品,1,奏耐天津,,@娜红玫瑰,@都市报道60分,@平安天津,@平安南开,@硬克先生,@北方网,@平安天津,@天津发布,@天津食品药品监管,4
硬克先生,娜红玫瑰：近日违法收售药贩子猖獗，在南开区汶水路上，每天晚上10点后，上百余药贩子将该条马路围的水泄不通，道路两旁都停着他们的私家车，不仅影响道路交通畅通，还严重妨碍周围居民的生活和安全，希望我市有关部门能联合出击，打掉这一违法行为！@都市报道60分 ​,0,24,3,2016-04-21 06:18:07,https://weibo.cn/comment/DrTeUAXjB?rl=1#cmtfrm,天津北方食品,1,奏耐天津,,@娜红玫瑰,@都市报道60分,@北方网,@平安天津,@天津发布,@天津食品药品监管,3
托马斯二大爷,2016年07月15日21点，多地企业自行监测数据发布平台显示，#蔚蓝地图#湖南娄底   韶峰南方水泥有限公司   “万花丛中两点绿@绿色潇湘-娄底站 @娄底发布 @娄底123456 @娄底环保热士 @绿色潇湘 @蔚蓝地图 ” 岳阳·虹桥镇 ​,0,0,2,2016-07-15 21:29:44,https://weibo.cn/comment/DEXr8bh6r?uid=5589014323&rl=1#cmtfrm,湖南韶峰南方水泥,,,,@绿色潇湘-娄底站,@娄底发布,@娄底123456,@娄底环保热士,@绿色潇湘,@蔚蓝地图,1
现世安稳_43301,#我要表扬#【湘潭市地税局召开“走出去”企业座谈会】11月21日，湘潭市地税局邀请全市7家“走出去”企业召开座谈会，省局国际税收管理处顾燕群处长、谢仲苏副处长，市外汇局、市国税局、市商务局等有关部门领导以及湘钢集团、湘电集团、步步高集团等“走出去”企业代表应邀参加了会议。市局党组书记、局长谷一飞对“走出去”企业代表出席座谈会表示欢迎和感谢，简单介绍了召开此次会议的主要目的，在全国强国之梦、复兴之路的大背景下，鼓励企业走出国门，支持“一带一路”战略发展，表示全市地税部门将牢记服务宗旨，加大对“走出去”企业纳税服务工作力度，积极构建扶持企业“走出去”税收服务体系，维护纳税人合法权益，并祝愿走出去企业蓬勃发展，为全市经济社会发展作出更大贡献。@中国文明网 @文明湘潭官博,0,0,0,2016-11-24 16:12:45,https://weibo.cn/comment/Ej2jGDOVC?uid=3430103070&rl=1#cmtfrm,湘电集团,,,,@中国文明网,@文明湘潭官博,1
湘潭浪漫,#湘江守望者##绿色卫士#2016.08.12 NO114 湘潭湘电集团排污口.～水量中～水清～无垃圾～PH7！阳塘排污口～水量小～水清～PH8～气味不大，生活垃圾有点。@湖南环保网 @贺子-cherry @绿色潇湘@湘潭矛戈@湘潭小雪无痕@湘潭环保迪迪 @上上若树 @湘潭云中雾@湘潭小武哥@湘潭解脱@湘潭阿度 @湘潭环保轩轩爸@湘潭小张@湘潭老陈@湘潭韭菜 @思难-GH @烟囱里的乌鸦_株洲 @株洲双面胶 @株洲老猫@湘潭岳塘环保局@湘潭环保局@湘潭环境保护局 @湘潭市环境保护局,0,2,6,2016-08-12 13:00:43,https://weibo.cn/comment/E3cC6mHiN?uid=3180320297&rl=1#cmtfrm,湘电集团,,,,@湖南环保网,@贺子-cherry,@绿色潇湘,@湘潭矛戈,@湘潭小雪无痕,@湘潭环保迪迪,@上上若树,@湘潭云中雾,@湘潭小武哥,@湘潭解脱,@湘潭阿度,@湘潭环保轩轩爸,@湘潭小张,@湘潭老陈,@湘潭韭菜,@思难-GH,@烟囱里的乌鸦_株洲,@株洲双面胶,@株洲老猫,@湘潭岳塘环保局,@湘潭环保局,@湘潭环境保护局,@湘潭市环境保护局,1
湘潭环保乞丐,#蔚蓝长株潭##莲城抗霾 特护期#23，1月10日周日8:30阴，湘潭市雨湖区护潭东路PM2.5为38良，我们继续一起守护碧水蓝天[拳头]（附@蔚蓝地图 显示湘电集团水污染在线监控更新日期为去年8月31日，累计数月未更新，信息公开给谁看）@绿色潇湘 @湖南省环境保护厅 @公众环境马军@贺子-cherry @思难-GH ​,1,1,3,2016-01-10 08:46:15,https://weibo.cn/comment/Dcrwn31fY?uid=1957744573&rl=1#cmtfrm,湘电集团,,,,@蔚蓝地图,@绿色潇湘,@湖南省环境保护厅,@公众环境马军,@贺子-cherry,@思难-GH,1
湘潭环保乞丐,#蔚蓝长株潭##莲城抗霾 特护期#22，1月9日周六20:30阴，湘潭市雨湖区护潭东路PM2.5为34良，我们继续一起守护碧水蓝天[拳头]（附@蔚蓝地图 显示湘电集团水污染在线监控更新日期为去年8月31日，累计数月未更新，信息公开给谁看）@绿色潇湘 @湖南省环境保护厅 @公众环境马军@贺子-cherry @思难-GH ​,0,0,4,2016-01-09 20:52:07,https://weibo.cn/comment/DcmQvfnUx?uid=1957744573&rl=1#cmtfrm,湘电集团,,,,@蔚蓝地图,@绿色潇湘,@湖南省环境保护厅,@公众环境马军,@贺子-cherry,@思难-GH,1
湘潭环保乞丐,#蔚蓝长株潭##莲城抗霾 特护期#21，1月4日周一15:30晴，湘潭市雨湖区富民城PM2.5为168重度污染，出门记得戴口罩，我们继续一起守护碧水蓝天[拳头]（附@蔚蓝地图 显示湘电集团水污染在线监控更新日期为去年8月31日，累计数月未更新，信息公开给谁看）@绿色潇湘 @湖南省环境保护厅 @公众环境马军 ​,3,3,14,2016-01-04 15:32:27,https://weibo.cn/comment/DbzCgvBTf?uid=1957744573&rl=1#cmtfrm,湘电集团,,,,@蔚蓝地图,@绿色潇湘,@湖南省环境保护厅,@公众环境马军,1
湘潭环保乞丐,蔚蓝长株潭##莲城抗霾 特护期#20，1月1日周五10:00阴，湘潭市护潭东路PM2.5为94良。新年快乐，16年我们继续一起守护碧水蓝天[拳头]（附@蔚蓝地图 显示湘电集团水污染在线监控形同虚设，累计数个月未更新[弱]，国企太牛[奶牛]）@绿色潇湘 @湖南省环境保护厅 @公众环境IPE @公众环境马军 @湖南省绿色卫士 ​,0,0,0,2016-01-01 10:18:14,https://weibo.cn/comment/Db5gA7wmk?rl=1#cmtfrm,湘电集团,1,湘潭环保乞丐,转发理由: 在线监控在湘电集团就是摆设，信息公开给谁看？@财经网 @柴静看见 @迟夙生律师 @法治中国鸿雁 @冯永锋 @何春银微想 @华菱集团 @环保SOS求助 @湖南身边事 @湖南省政府门户网站 @湖南微政务 @IFCE何平 @家驯 @孑然自处 @联合国环境规划署 @李波听雨 @柳肃 @刘帅168 @绿水青山总关情 @人民日报 @三记者       ,@蔚蓝地图,@绿色潇湘,@湖南省环境保护厅,@公众环境IPE,@公众环境马军,@湖南省绿色卫士,@财经网,@柴静看见,@迟夙生律师,@法治中国鸿雁,@冯永锋,@何春银微想,@华菱集团,@环保SOS求助,@湖南身边事,@湖南省政府门户网站,@湖南微政务,@家驯,@孑然自处,@联合国环境规划署,@李波听雨,@柳肃,@刘帅168,@绿水青山总关情,@人民日报,@三记者,3
湘潭环保乞丐,#蔚蓝长株潭##莲城抗霾 特护期#20，1月1日周五10:00阴，湘潭市护潭东路PM2.5为94良。新年快乐，16年我们继续一起守护碧水蓝天[拳头]（附@蔚蓝地图 显示湘电集团水污染在线监控形同虚设，累计数个月未更新[弱]，国企太牛[奶牛]）@绿色潇湘 @湖南省环境保护厅 @公众环境IPE @公众环境马军 @湖南省绿色卫士 ​,0,0,7,2016-01-01 10:16:37,https://weibo.cn/comment/Db5gA7wmk?uid=1957744573&rl=1#cmtfrm,湘电集团,,,,@蔚蓝地图,@绿色潇湘,@湖南省环境保护厅,@公众环境IPE,@公众环境马军,@湖南省绿色卫士,1
己莫为1991,"#最美吴忠人# 【七尺男儿孝母心，柔肠铁肩众人赞】施永刚是华能宁夏大坝发电有限责任公司发电部一名普通职工，他以孝道为荣，用自己的实际行动践行着为人儿女的本份和责任，十几年如一日地照顾重病在床的母亲，在平凡的生活中演绎着点点滴滴的亲情故事。七尺男儿孝母心,柔肠铁肩众人赞 @吴忠文明网 @中国文明网 ​",2,1,17,2016-07-22 18:57:59,https://weibo.cn/comment/E02YGjikY?uid=3877485976&rl=1#cmtfrm,宁夏大坝发电,,,,@吴忠文明网,@中国文明网,1
微微820829,#九九重阳节#岁岁重阳，今日重阳。今天10月9日是传统的重阳节，华能宁夏大坝发电有限责任公司退休职工组织了一场精彩纷呈的文艺演出，舞蹈，独唱，诗朗诵，合唱，二胡独奏，让人目不暇接。祝天下所有父母身体健康，快乐相伴！@吴忠文明网 青铜峡市 ​,0,0,0,2016-10-09 16:21:08,https://weibo.cn/comment/Ec2Ifu9TZ?uid=3873646771&rl=1#cmtfrm,宁夏大坝发电,,,,@吴忠文明网,1
己莫为1991,"#最美吴忠人# 【七尺男儿孝母心，柔肠铁肩众人赞】施永刚是华能宁夏大坝发电有限责任公司发电部一名普通职工，他以孝道为荣，用自己的实际行动践行着为人儿女的本份和责任，十几年如一日地照顾重病在床的母亲，在平凡的生活中演绎着点点滴滴的亲情故事。七尺男儿孝母心,柔肠铁肩众人赞 @吴忠文明网 @中国文明网 ​",2,1,17,2016-07-22 18:57:59,https://weibo.cn/comment/E02YGjikY?uid=3877485976&rl=1#cmtfrm,宁夏大坝发电,,,,@吴忠文明网,@中国文明网,1
