幸福平安快乐5376,@吉林省环境保护厅 @好空气保卫侠 通化钢铁股份有限公司，吉林省通化市二道江区电力公司无组织排放 ​,1,0,2,2016-11-20 18:41:37,https://weibo.cn/comment/EirA7yt51?uid=5911743578&rl=1#cmtfrm,吉林电力股份,,,,@吉林省环境保护厅,@好空气保卫侠,1
央企新闻眼,#点赞帖##一线故事#人生是拼起来的图卷。只有用心绘制每一块小小的拼图，才能最终组合成完美的人生版图！吉林电力股份有限公司二道江发电公司李俊宏，从未停止过积极进取的脚步，18年换了9个工作岗位，从一名普通的燃料分场检修工人做起，先后担任班长，专工、主任，设备部主任，白城维护项目部经理，生产技术部主任兼副总工程师等，以实际行动打拼出了一份多彩的人生。@吉林省经合局,1,0,2,2016-04-18 13:23:40,https://weibo.cn/comment/DrwE8gT1H?uid=3227190870&rl=1#cmtfrm,吉林电力股份,,,,@吉林省经合局,1
央企新闻眼,#点赞贴##一线故事#人生是拼起来的图卷。只有用心绘制每一块小小的拼图，才能最终组合成完美的人生版图！吉林电力股份有限公司二道江发电公司李俊宏，从未停止过积极进取的脚步，18年换了9个工作岗位，从一名普通的燃料分场检修工人做起，先后担任班长，专工、主任，设备部主任，白城维护项目部经理，生产技术部主任兼副总工程师等，以实际行动打拼出了一份多彩的人生。@吉林省经合局,0,2,2,2016-04-16 23:21:35,https://weibo.cn/comment/DrhHPDIWq?uid=3227190870&rl=1#cmtfrm,吉林电力股份,,,,@吉林省经合局,1
花子风0916,2016年01月05日23点，吉林电力股份有限公司四平热电公司在线监测数据，希望排放浓度高的企业作出公开说明！#蔚蓝地图#@吉林省环境保护厅 @四平市环保局互动交流 @好空气保卫侠  ​,0,0,1,2016-01-05 23:43:21,https://weibo.cn/comment/DbMg1jEZv?uid=2611339491&rl=1#cmtfrm,吉林电力股份,,,,@吉林省环境保护厅,@四平市环保局互动交流,@好空气保卫侠,1
绿氧生态环保中心,#卫蓝绿水#根据四川省重点监控企业污染源监测信息公开平台12月23日发布的数据显示：位于南充市污染源—南充市嘉东城市生活污水处理有限公司和南充污水处理有限责任公司的在线监测数据更新延迟，请南充市环保局及时关注，同时希望南充市环保局开通新浪微博，便于公众及时反应环境问题。@南充播报 @最南充 @四川环保 @环保部发布 @成都环保 @合一绿学院 @SEE创绿家 @阿里巴巴公益基金会 @SEE官方微博 @卫蓝基金 @北京环助律所 @蔚蓝地图 @锦江环保 @四川卫视 @四川共青团 @华西都市报 @中华环境保护基金会 @CUIT学生环境保护协会,0,0,0,2016-12-23 17:23:43,https://weibo.cn/comment/EnsaTeqzS?uid=5238524057&rl=1#cmtfrm,南充市嘉东城市生活污水处理,,,,@南充播报,@最南充,@四川环保,@环保部发布,@成都环保,@合一绿学院,@阿里巴巴公益基金会,@卫蓝基金,@北京环助律所,@蔚蓝地图,@锦江环保,@四川卫视,@四川共青团,@华西都市报,@中华环境保护基金会,3
京局唐段_wangjunjie1990,唐山南站，东风10D唐山钢铁集团自备车。司机小叔好搞笑，一直冲我笑，而且还和我打招呼，好评！[good][good][good]@铁路唐山南站 @火车印象 @兰局嘉段Jloery @衡局东段 @火车入魔 @上局新长的DF猪 唐山·路北区 秒拍视频 . ​,4,3,0,2016-09-04 20:06:20,https://weibo.cn/comment/E6Keh7wfi?uid=2504351285&rl=1#cmtfrm,唐山钢铁集团,,,,@铁路唐山南站,@火车印象,@兰局嘉段Jloery,@衡局东段,@火车入魔,@上局新长的DF猪,1
法治当涂,面对欠薪，律师教你如何维权？如何维权[围观][围观]@高密普法 @贵州省凯里监狱 @-娃娃戏水- @马鞍山当涂发电有限公司团委 @辰溪交通警察 ​,0,4,13,2016-12-27 05:21:50,https://weibo.cn/comment/EnZ9Rr9ZP?uid=5397563013&rl=1#cmtfrm,马鞍山当涂发电,,,,@高密普法,@贵州省凯里监狱,@马鞍山当涂发电有限公司团委,@辰溪交通警察,1
法治当涂,面对欠薪，律师教你如何维权？如何维权[围观][围观]@高密普法 @贵州省凯里监狱 @-娃娃戏水- @马鞍山当涂发电有限公司团委 @辰溪交通警察 ​,0,4,13,2016-12-27 05:21:50,https://weibo.cn/comment/EnZ9Rr9ZP?uid=5397563013&rl=1#cmtfrm,马鞍山当涂发电,,,,@高密普法,@贵州省凯里监狱,@马鞍山当涂发电有限公司团委,@辰溪交通警察,1
张慎涛zst,2016年01月27日20点，兖矿鲁南化肥厂在线监测数据，希望排放浓度高的企业作出公开说明！#蔚蓝地图#@山东空气观察团 @山东环境 @滕州环保 @枣庄环保 ​,0,0,0,2016-01-27 20:20:05,https://weibo.cn/comment/Df6krexpT?uid=5111532009&rl=1#cmtfrm,兖矿鲁南化肥厂,,,,@山东空气观察团,@山东环境,@滕州环保,@枣庄环保,3
贵州人老王,国电安顺第二发电有限公司在线监测数据，希望排放浓度高的企业作出公开说明，2016年11月24日07点。#蔚蓝地图#http://t.cn/RftYCWX @贵州环保365 @公众环境马军 @黔仁生态 @蔚蓝地图 ​,0,1,5,2016-11-24 07:52:31,https://weibo.cn/comment/EiZ2Dxjt2?uid=1885703734&rl=1#cmtfrm,国电安顺发电,,,,@贵州环保365,@公众环境马军,@黔仁生态,@蔚蓝地图,1
星光时尚体育,2016年12月18日09点，凌源市安泰供热有限责任公司在线监测数据，希望排放浓度高的企业作出公开说明！#蔚蓝地图# http://t.cn/RfzsX51 @辽宁环保 ​,0,0,0,2016-12-18 09:28:06,https://weibo.cn/comment/EmDVm3Gm3?uid=1948267020&rl=1#cmtfrm,凌源市安泰供热,,,,@辽宁环保,1
煮酒论英雄999,2016年12月17日21点，凌源市安泰供热有限责任公司在线监测数据，希望排放浓度高的企业作出公开说明！#蔚蓝地图# http://t.cn/RfzsX51 @辽宁环保 ​,0,0,0,2016-12-17 21:26:13,https://weibo.cn/comment/EmzcleXmv?uid=5447473291&rl=1#cmtfrm,凌源市安泰供热,,,,@辽宁环保,1
蔚蓝地图,郸成晟水务有限公司新坡在线监测数据，希望排放浓度高的企业作出公开说明！2016年09月07日07点#蔚蓝地图# http://t.cn/RcbLjH4 ​,1,2,21,2016-09-08 11:56:10,https://weibo.cn/comment/E77FB0U8z?rl=1#cmtfrm,邯郸成晟水务,1,大丰市环保志愿者,转发理由:希望排放浓度高的邯郸成晟水务有限公司新坡作出公开说明！@河北省环保厅 @邯郸市环境保护局 @孔媛媛 @绿行太行 @公众环境马军      ,@河北省环保厅,@邯郸市环境保护局,@孔媛媛,@绿行太行,@公众环境马军,1
滨城区环保分局,"#关于中海沥青股份有限公司火炬异常排放的调查情况#火炬是石油炼厂必需的安全设施，为保障不造成安全环保事故设立。5月30日7:13因电气异常富气压缩机停运,在气柜储满后为保障装置安全于7:30排放造成火炬排放异常,8:10富气压缩机开车后火炬恢复正常运行。目前正在进行善后处理。@滨州环保 ​",2,3,7,2016-05-30 14:52:35,https://weibo.cn/comment/DxVb52HN2?uid=3369627890&rl=1#cmtfrm,中海沥青股份,,,,@滨州环保,1
银川规划,夏石化公司搬不搬 @问政银川 ​,0,4,0,2016-05-05 16:13:56,https://weibo.cn/comment/DtWXp4BRC?rl=1#cmtfrm,中国石油宁夏石化公司,1,怀念独此一人,,@问政银川,1
蓬溪城市在线,【蓬溪县8家企业成为县环境保护部门2016重点监管对象】近日，蓬溪县环境保护局官方网站公布了8家该局2016年将重点监管的企业名单。分别是：蓬溪县辉达投资水务有限责任公司（来龙山污水处理厂）、蓬溪县辉达投资水务有限责任公司（清源污水处理厂）、常州新区佳琦电子产品有限公司蓬溪县分公司、蓬溪县炬叶纸厂、蓬溪县天宫堂养猪专业合作社、四川大山坡良种畜禽有限公司、四川通德农牧有限责任公司、蓬溪华亨泰丰农牧发展有限公司。@聆听遂宁 @复兴遂州 @斗时尚杂志刘旭 @四川遂宁新闻播报 @遂宁市环境保护局 @遂宁新媒体_陈 @遂宁网 @遂宁之窗 @听遂宁 @直播遂宁 @遂宁新闻网 @遂宁电视台新闻零距离 @四川新闻网遂宁频道 @四川在线遂宁频道道长 @有文化的村花 @斗城表里如一 @遂宁快乐的士 @遂宁老黑 @遂宁网事,3,0,5,2016-06-16 18:41:40,https://weibo.cn/comment/DAwWvFqpO?uid=1699731917&rl=1#cmtfrm,蓬溪县来龙山污水处理厂,,,,@聆听遂宁,@复兴遂州,@斗时尚杂志刘旭,@四川遂宁新闻播报,@遂宁市环境保护局,@遂宁新媒体_陈,@遂宁网,@遂宁之窗,@听遂宁,@直播遂宁,@遂宁新闻网,@遂宁电视台新闻零距离,@四川新闻网遂宁频道,@四川在线遂宁频道道长,@有文化的村花,@斗城表里如一,@遂宁快乐的士,@遂宁老黑,@遂宁网事,1
凤之城广元,#广元身边事#【食药监总局抽查：太极集团小儿咳喘灵等药品不合格[话筒]】近期食药监总局抽验发现，25家药企生产的29批次药品不合格。包括吉林百姓堂药业的安神补心片，广西世彪药业的复方丹参片，太极集团的小儿咳喘灵颗粒、陕西华龙制药的小儿退热口服液等，不合格项目包括细菌数、酸度等。不合格详单↓↓↓扩散提醒！@广食药监 @广元质监,3,1,2,2016-11-29 11:38:34,https://weibo.cn/comment/EjLESkc22?uid=2120621667&rl=1#cmtfrm,广西世彪药业,,,,@广食药监,@广元质监,1
青春广元,#广元身边事#【食药监总局抽查：太极集团小儿咳喘灵等药品不合格[话筒]】近期食药监总局抽验发现，25家药企生产的29批次药品不合格。包括吉林百姓堂药业的安神补心片，广西世彪药业的复方丹参片，太极集团的小儿咳喘灵颗粒、陕西华龙制药的小儿退热口服液等，不合格项目包括细菌数、酸度等。不合格详单↓扩散提醒！@广食药监,3,3,7,2016-11-29 11:30:03,https://weibo.cn/comment/EjLBq7kzU?uid=2120798421&rl=1#cmtfrm,广西世彪药业,,,,@广食药监,1
是桉树叶子,西安石油大学新校区的邻居就是国维淀粉厂 学校四个年级的学生都笼罩在浓郁的淀粉空气中 本来远离市区的唯一环境优势被刺鼻的淀粉味给代替了 都不知道还有什么潜在伤害 然而这一切都没有人出来说句话 非要等出事么#被污染的学校#@陕西省教育厅 @西安石油大学论坛 @吃喝玩乐来西安 西安·西安石油大学(潭滨南路) ​,35,32,3,2016-04-18 23:31:22,https://weibo.cn/comment/DrACNtKYF?uid=3065708421&rl=1#cmtfrm,西安国维淀粉,,,,@陕西省教育厅,@西安石油大学论坛,@吃喝玩乐来西安,1
--听风起--,@临沭环保 @临沂环境 @临沂百姓事 临沭夜查第二站，金沂蒙集团，企业正在生产，治污设施运行正常，检查人员采取水样待测。（和第一站一起发啦，时间仓促[挤眼]） 临沂·临沭县 ​,0,1,2,2016-12-06 20:56:43,https://weibo.cn/comment/EkTiU95dh?uid=5158347591&rl=1#cmtfrm,金沂蒙集团,,,,@临沭环保,@临沂环境,@临沂百姓事,2
--听风起--,@临沂环境 @临沭环保 临沭环保夜查第一站金沂蒙集团排污口，询问生产情况并采水检测 ​,1,1,1,2016-09-05 21:24:47,https://weibo.cn/comment/E6UaC7BP5?uid=5158347591&rl=1#cmtfrm,金沂蒙集团,,,,@临沂环境,@临沭环保,2
森然小木,王学桂局长带领夜查二组对金沂蒙集团进行夜查，在污水排放口现场取样！@临沭环保 ​,3,2,3,2016-08-08 23:34:53,https://weibo.cn/comment/E2F3w99kj?uid=5902175170&rl=1#cmtfrm,金沂蒙集团,,,,@临沭环保,1
四个全面绿色生态,7月13日，市大气第三督导组来我县对德坤建材、贝儿建材、金正阳管业、金宝诚管业、金沂蒙集团等5家再提高治理企业进行现场督导。@临沭环保 @--听风起-- 临沂·郑山街区 ​,0,0,0,2016-07-13 11:59:57,https://weibo.cn/comment/DEAQQwCEn?uid=2747722531&rl=1#cmtfrm,金沂蒙集团,,,,@临沭环保,1
四个全面绿色生态,6月22，县大气办联合县环保局对列入大气污染防治的金源管业、德坤建材、金沂蒙集团、欧冠陶瓷等企业再提高治理进行现场督导检查。@临沭环保 @--听风起-- 临沂·临沭街区 ​,0,0,0,2016-06-22 22:55:58,https://weibo.cn/comment/DBtaIdWeR?uid=2747722531&rl=1#cmtfrm,金沂蒙集团,,,,@临沭环保,1
中国社会科学院欧亚所史凝博博士,前段时间在广场泰康人寿一个长治哪里的女的骗我，说是送净水器，没送，她带两个男孩。我老家长治沁源县的。这个穿红裙子女的说她是长治的。这些人我都不认识，我也不认识几个长治的。我没回过老家，好像是山沟里。@平安太原 ​,0,0,0,2016-06-29 10:30:56,https://weibo.cn/comment/DCshM3oHn?uid=1715480322&rl=1#cmtfrm,沁源县净水,,,,@平安太原,1
青赣环境交流中心,#赣江流域环境信息公开#根据江西省环境质量发布平台数据显示，发现位于南昌市经开区的国控污染源——江西晨鸣纸业有限责任公司在从22日1时开始出现污水排放氨氮和化学需氧量数据超标，根据南昌市公布的环境行政处罚记录显示，该企业在2016年多次因超标排放被环保部门处罚。监督污染行为，青赣在行动！@蔚蓝地图 @江西环保 @南昌环境保护局发布 @信息日报 @阿里巴巴公益基金会 @合一绿学院,0,0,0,2016-10-22 11:19:09,https://weibo.cn/comment/EdZi7EZfi?uid=2073022367&rl=1#cmtfrm,江西晨鸣纸业,,,,@蔚蓝地图,@江西环保,@南昌环境保护局发布,@信息日报,@阿里巴巴公益基金会,@合一绿学院,2
鲁小梦,驻马店交通路西段天方药业每天晚上和早晨释放刺鼻气体，白天都不敢开窗透气，晚上隔着窗户缝都能钻进来，这大半夜的让人熏得睡不着觉！也没有人管，每天都放，周围有学校，还全部都是住宅区！驻马店真的在治理大气污染吗？还是只是在做样子应付检查！@新浪环保 @精彩河南 @文明驻马店政府办 @大河报 @驻马店日报,2,4,3,2016-11-24 00:10:22,https://weibo.cn/comment/EiW13g57z?uid=2276927235&rl=1#cmtfrm,天方药业,,,,@新浪环保,@精彩河南,@文明驻马店政府办,@大河报,@驻马店日报,2
南信环协,【溧水环保局、南京环务资源再生科技有限公司访谈】今天下午，在毛毛细雨中，环协的志愿者们来到了南京环务资源再生科技有限公司，想通过对电子垃圾处理公司详尽的了解来促进绿色电子理念的推广。接受此次访谈的主要负责人包括溧水环保局固废处科长、副大队长和南京环务资源再生科技有限公司的代表。几位负责人先是借用幻灯片放映的方式详细地向志愿者们解读了电子垃圾的相关政策，并对公司的概况做了初步介绍，随后公司负责人带领志愿者们参观了生产车间并深入解答了志愿者们提出的问题。本次访谈让志愿者们明确了政府和企业的定位问题，对电子垃圾概念宣传工作也有了更为明朗的切入点。[害羞][害羞][害羞]@江苏环保 @南京环保 @金陵晚报 @南京日报 @溧水环保 @溧水发布,10,0,5,2016-07-14 21:42:04,https://weibo.cn/comment/DEO5DA5RR?uid=1833098547&rl=1#cmtfrm,南京环务资源再生科技,,,,@江苏环保,@南京环保,@金陵晚报,@南京日报,@溧水环保,@溧水发布,3
郊区派出所,#多部门协作开展井下安全生产事故救援演练#6月24日，郊区派出所联合郊区安监局、郊区经促局、金九集团在金顺矿业开展了安全生产事故救援演练。 演练假设铜陵市金顺矿业井下工人在采矿和掘进时发生炮烟中毒事件，多名工人中毒被困井下。 在半个多小时的实战演练过程中，救援队紧密配合、奋勇向前，圆满地完成了此次应急救援演练，提升了安全生产意识，增强了辖区企业应对紧急事故的处置能力。@铜陵郊区治安在线 @铜陵平安郊区,0,0,0,2016-06-30 19:33:51,https://weibo.cn/comment/DCFgE82l3?uid=5413512489&rl=1#cmtfrm,铜陵市金顺矿业,,,,@铜陵郊区治安在线,@铜陵平安郊区,2
郊区派出所,#多部门协作开展井下安全生产事故救援演练#6月24日，郊区派出所联合郊区安监局、郊区经促局、金九集团在金顺矿业开展了安全生产事故救援演练。 演练假设铜陵市金顺矿业井下工人在采矿和掘进时发生炮烟中毒事件，多名工人中毒被困井下。 在半个多小时的实战演练过程中，救援队紧密配合、奋勇向前，圆满地完成了此次应急救援演练，提升了安全生产意识，增强了辖区企业应对紧急事故的处置能力。@铜陵郊区治安在线 @铜陵平安郊区,0,0,0,2016-06-30 19:33:51,https://weibo.cn/comment/DCFgE82l3?uid=5413512489&rl=1#cmtfrm,铜陵市金顺矿业,,,,@铜陵郊区治安在线,@铜陵平安郊区,2
达州安监,2016年2月24日，达州市安监局局长王建到渠县检查调研安全生产工作，现场查看了华新水泥渠县分公司、重庆天然气净化总厂渠县分厂以及渠县瑞峰花炮责任有限公司。县政府副县长贾文军、县安监局局长雷长安、副局长王小波、胡超明等陪同调研.@四川安监煤监 ​,0,0,0,2016-02-24 16:19:18,https://weibo.cn/comment/DjkIBBwQT?uid=3930794463&rl=1#cmtfrm,华新水泥（渠县）,,,,@四川安监煤监,1
国网淄博供电公司,10月12日，国网淄博供电公司周村客户服务分中心用电检查人员对中国石化催化剂有限公司齐鲁分公司进行专项安全检查。　　为确保大客户和高危企业的安全用电，国网淄博供电公司主动走出去服务，为企业查隐患、解难题、堵漏洞，督导企业安全用电，为企业健康发展注入活力。（李汉栋）@国网山东省电力公司 @国家电网 @电网头条 @国家电网报 @亮报 @中国电力报 @中国电力新闻网 @淄博大众网 @齐鲁晚报今日淄博 @淄博新闻网 @鲁中晨报 @鲁中网 @淄博发布 @淄博时空新闻网 @淄博信息港官方微博,1,0,0,2016-10-13 08:48:59,https://weibo.cn/comment/EcBsHcqmU?uid=1241601477&rl=1#cmtfrm,中国石化催化剂,,,,@国网山东省电力公司,@国家电网,@电网头条,@国家电网报,@亮报,@中国电力报,@中国电力新闻网,@淄博大众网,@齐鲁晚报今日淄博,@淄博新闻网,@鲁中晨报,@鲁中网,@淄博发布,@淄博时空新闻网,@淄博信息港官方微博,1
PECC-LN,东平县泰龙食品有限公司，在山东省国家重点监控企业自行监测信息发布平台上数据显示，其COD数据间断性超标排放。请环保部发布 关注，请 @山东环境 @泰安环境 给予说明。@绿色江南公众环境关注中心 @蔚蓝地图#蔚蓝地图# @PECC-LiJ ​,0,4,8,2016-12-29 16:36:33,https://weibo.cn/comment/EomqJk4jR?uid=5907562386&rl=1#cmtfrm,东平县泰龙食品,,,,@山东环境,@泰安环境,@绿色江南公众环境关注中心,@蔚蓝地图,2
蔚蓝地图,平县泰龙食品有限公司，在山东省国家重点监控企业自行监测信息发布平台上数据显示，其COD数据间断性超标排放。请@山东环境 @泰安环境 给予说明。@绿色江南公众环境关注中心 @蔚蓝地图#蔚蓝地图# @PECC-YR ​,2,4,21,2016-11-02 16:41:30,https://weibo.cn/comment/EfH5CABlx?rl=1#cmtfrm,东平县泰龙食品,1,PECC-LN,转发理由:希望排放浓度高的东平县泰龙食品有限公司作出公开说明!@泰安环境 @山东环境 @公众环境马军 @泰安城市资讯 @泰安正能量 @泰安市滴水公益协会      ,@山东环境,@泰安环境,@绿色江南公众环境关注中心,@蔚蓝地图,@泰安环境,@山东环境,@公众环境马军,@泰安城市资讯,@泰安正能量,@泰安市滴水公益协会,4
PECC-LN,东平县泰龙食品有限公司，在山东省国家重点监控企业自行监测信息发布平台上数据显示，其COD数据间断性超标排放。请@山东环境 @泰安环境 给予说明。@绿色江南公众环境关注中心 @蔚蓝地图#蔚蓝地图# @PECC-YR ​,0,4,24,2016-11-02 16:39:31,https://weibo.cn/comment/EfH5CABlx?uid=5907562386&rl=1#cmtfrm,东平县泰龙食品,,,,@山东环境,@泰安环境,@绿色江南公众环境关注中心,@蔚蓝地图,2
铜陵网络资讯,#铜陵身边事# 【铜陵3项省地方标准制订项目获准立项】日前，省质监局公布了2016年度第二批安徽省地方标准制修订项目计划，铜陵市申报的3个项目名列其中。这三个项目分别是由铜陵有色金属集团股份有限公司稀贵金属分公司主持起草的《铜渣尾矿化学分析方法 铁、铜含量的测定》、由铜陵铜冠神虹化工有限责任公司主持起草的《焦炉煤气生产硫化钠技术规程》和由安徽张林渔业有限公司主持起草的《池塘循环流水养殖鱼技术规范》，项目类型主要涉及有色金属分析方法、化工产品生产规程及农业生产规范。via.铜陵新闻网 @安徽质检 @铜陵质监,2,0,1,2016-08-18 09:30:03,https://weibo.cn/comment/E45Nz8ozL?uid=2008732281&rl=1#cmtfrm,铜陵有色金属集团股份,,,,@安徽质检,@铜陵质监,1
宁静的阳光,山东东华水泥厂二氧化硫排放超标@淄博环保 @山东环境 @绿行齐鲁 @淄博环保 ​,0,0,1,2016-04-20 07:11:17,https://weibo.cn/comment/DrN3Z0TZ8?uid=1417219004&rl=1#cmtfrm,山东东华水泥,,,,@淄博环保,@山东环境,@绿行齐鲁,@淄博环保,3
绿氧生态环保中心,#卫蓝绿水#根据四川省重点监控企业污染源监测信息公开平台12月23日发布的数据显示：位于南充市污染源—南充市嘉东城市生活污水处理有限公司和南充污水处理有限责任公司的在线监测数据更新延迟，请南充市环保局及时关注，同时希望南充市环保局开通新浪微博，便于公众及时反应环境问题。@南充播报 @最南充 @四川环保 @环保部发布 @成都环保 @合一绿学院 @SEE创绿家 @阿里巴巴公益基金会 @SEE官方微博 @卫蓝基金 @北京环助律所 @蔚蓝地图 @锦江环保 @四川卫视 @四川共青团 @华西都市报 @中华环境保护基金会 @CUIT学生环境保护协会,0,0,0,2016-12-23 17:23:43,https://weibo.cn/comment/EnsaTeqzS?uid=5238524057&rl=1#cmtfrm,南充污水处理,,,,@南充播报,@最南充,@四川环保,@环保部发布,@成都环保,@合一绿学院,@阿里巴巴公益基金会,@卫蓝基金,@北京环助律所,@蔚蓝地图,@锦江环保,@四川卫视,@四川共青团,@华西都市报,@中华环境保护基金会,3
今天世界末日了吗_,2016年03月14日15点，华电国际电力股份有限公司邹县发电厂在线监测数据，希望排放浓度高的企业作出公开说明！#蔚蓝地图# @邹城环保 @济宁环境 @山东环境 ​,0,4,4,2016-03-14 15:47:11,https://weibo.cn/comment/DmdD0njKe?uid=5828571729&rl=1#cmtfrm,华电国际电力股份,,,,@邹城环保,@济宁环境,@山东环境,2
南宁货运中心,来宾所营销小组走访来宾华锡冶炼有限公司，了解该公司生产、经营情况以及运输需求，铁路货运部门将会根据其特点提供相应的服务。@南宁铁路 ​,0,0,0,2016-06-30 22:39:41,https://weibo.cn/comment/DCGu4j1jE?uid=3853813760&rl=1#cmtfrm,来宾华锡冶炼,,,,@南宁铁路,1
PECC-LN,江苏新海发电有限公司，在江苏省企业自行监测平台上数据显示，其二氧化硫数据显示连续多日超标排放。请 @江苏环保 @港城环保  给予说明。@绿色江南公众环境关注中心 @蔚蓝地图#蔚蓝地图# @PECC-LiJ ​,0,1,1,2016-11-14 14:40:03,https://weibo.cn/comment/Ehvr5Aulp?uid=5907562386&rl=1#cmtfrm,江苏新海发电,,,,@江苏环保,@港城环保,@绿色江南公众环境关注中心,@蔚蓝地图,2
PECC-LN,江苏新海发电有限公司，在江苏省企业自行监测平台上数据显示，其氮氧化物数据显示连续多日超标排放。请 @江苏环保 @港城环保  给予说明。@绿色江南公众环境关注中心 @蔚蓝地图#蔚蓝地图# @PECC-YR ​,0,1,1,2016-11-03 16:27:56,https://weibo.cn/comment/EfQrq7Kv7?uid=5907562386&rl=1#cmtfrm,江苏新海发电,,,,@江苏环保,@港城环保,@绿色江南公众环境关注中心,@蔚蓝地图,2
蔚蓝地图,016年02月19日00点，东莞市祥兴纸业有限公司在线监测数据，希望排放浓度高的企业作出公开说明！#蔚蓝地图#@东莞环保 ​,1,2,3,2016-02-19 09:48:10,https://weibo.cn/comment/DitsTnAb6?rl=1#cmtfrm,东莞市祥兴纸业,1,_SpiritLee_,转发理由:希望排放浓度高的东莞市祥兴纸业有限公司作出公开说明！@南粤绿声 @南粤环保公益之声 @广东水污染地图 @自然之友广州小组 @公众环境马军      ,@东莞环保,@南粤绿声,@南粤环保公益之声,@广东水污染地图,@自然之友广州小组,@公众环境马军,1
PECC-LN,南京红太阳股份有限公司 ，在江苏省企业自行监测平台上数据显示，其PH值显示连续多日超标排放。请 @江苏环保 @南京环保 做出公开说明。@绿色江南公众环境关注中心 @蔚蓝地图#蔚蓝地图# @PECC-YR @PECC-CB @PECC-JJW @PECC-ZXP ​,0,0,1,2016-10-18 13:56:54,https://weibo.cn/comment/EdoCb3UsK?uid=5907562386&rl=1#cmtfrm,南京红太阳股份,,,,@江苏环保,@南京环保,@绿色江南公众环境关注中心,@蔚蓝地图,2
