PECC-LN,乐平市天新热电有限公司，在江西省环境质量信息发布平台上数据显示，其二氧化硫连续多日超标排放、氮氧化物及烟尘间断性超标排放，请 @江西环保 @瓷都环保   关注。 @绿色江南公众环境关注中心 @蔚蓝地图#蔚蓝地图# @PECC-YR @PECC-CB @PECC-JJW @PECC-ZXP ​,0,2,2,2016-10-12 17:09:25,https://weibo.cn/comment/Ecvjl91yF?uid=5907562386&rl=1#cmtfrm,乐平市天新热电,,,,@江西环保,@瓷都环保,@绿色江南公众环境关注中心,@蔚蓝地图,2
大王一杰,2016年04月16日17点，利津县环海污水处理有限公司在线监测数据，希望排放浓度高的企业作出公开说明！#蔚蓝地图#@环保东营 又超标@山东环境 @蔚蓝地图 @微言环保 @绿行齐鲁 @豫鲁风骨 @孤独求单 @常山蛇1 ​,2,3,3,2016-04-16 17:33:38,https://weibo.cn/comment/DrfqBgF8V?uid=5660231680&rl=1#cmtfrm,利津县环海污水处理,,,,@环保东营,@山东环境,@蔚蓝地图,@微言环保,@绿行齐鲁,@豫鲁风骨,@孤独求单,@常山蛇1,2
蔚蓝地图,016年03月31日06点，利津县环海污水处理有限公司在线监测数据，希望排放浓度高的企业作出公开说明！#蔚蓝地图#@环保东营 此企业依然设备故障？@山东环境 @蔚蓝地图 @微言环保 @豫鲁风骨 @绿行齐鲁 @山东空气观察团 @常山蛇1 @油城守卫者 ​,2,1,1,2016-03-31 07:36:36,https://weibo.cn/comment/DoKgpndcZ?rl=1#cmtfrm,利津县环海污水处理,1,大王一杰,转发理由:希望排放浓度高的利津县环海污水处理有限公司做出公开说明@山东环境 @公众环境马军      ,@环保东营,@山东环境,@蔚蓝地图,@微言环保,@豫鲁风骨,@绿行齐鲁,@山东空气观察团,@常山蛇1,@油城守卫者,@山东环境,@公众环境马军,3
大王一杰,2016年03月31日06点，利津县环海污水处理有限公司在线监测数据，希望排放浓度高的企业作出公开说明！#蔚蓝地图#@环保东营 此企业依然设备故障？@山东环境 @蔚蓝地图 @微言环保 @豫鲁风骨 @绿行齐鲁 @山东空气观察团 @常山蛇1 @油城守卫者 ​,0,1,2,2016-03-31 06:32:47,https://weibo.cn/comment/DoKgpndcZ?uid=5660231680&rl=1#cmtfrm,利津县环海污水处理,,,,@环保东营,@山东环境,@蔚蓝地图,@微言环保,@豫鲁风骨,@绿行齐鲁,@山东空气观察团,@常山蛇1,@油城守卫者,2
大王一杰,2016年03月29日20点，利津县环海污水处理有限公司在线监测数据，希望排放浓度高的企业作出公开说明！#蔚蓝地图#@环保东营 继续超标！@山东环境 @微言环保 @豫鲁风骨 @蔚蓝地图 @绿行齐鲁 @山东空气观察团 @油城守卫者 @海雪风暴 ​,0,0,0,2016-03-29 20:30:48,https://weibo.cn/comment/DowTzyvSo?uid=5660231680&rl=1#cmtfrm,利津县环海污水处理,,,,@环保东营,@山东环境,@微言环保,@豫鲁风骨,@蔚蓝地图,@绿行齐鲁,@山东空气观察团,@油城守卫者,@海雪风暴,2
大王一杰,2016年03月29日19点，利津县环海污水处理有限公司在线监测数据，希望排放浓度高的企业作出公开说明！#蔚蓝地图#@环保东营 今天第二家设备故障哈@山东环境 @微言环保 @豫鲁风骨 @山东空气观察团 @蔚蓝地图 @常山蛇1 @绿行齐鲁 @油城守卫者 @海雪风暴 ​,2,3,4,2016-03-29 19:46:08,https://weibo.cn/comment/DowBrtOGD?uid=5660231680&rl=1#cmtfrm,利津县环海污水处理,,,,@环保东营,@山东环境,@微言环保,@豫鲁风骨,@山东空气观察团,@蔚蓝地图,@常山蛇1,@绿行齐鲁,@油城守卫者,@海雪风暴,2
PECC-LN,富阳钓鱼实业有限公司，在浙江省企业自行监测平台上数据显示，其COD数据显示连续多日超标排放，请 @浙江环保 @杭州环保 @富阳环保 给予说明。 @绿色江南公众环境关注中心 @蔚蓝地图#蔚蓝地图# @PECC-LiJ ​,0,2,44,2016-11-17 10:18:21,https://weibo.cn/comment/EhW0mbri3?uid=5907562386&rl=1#cmtfrm,富阳钓鱼实业,,,,@浙江环保,@杭州环保,@富阳环保,@绿色江南公众环境关注中心,@蔚蓝地图,3
PECC-LN,富阳钓鱼实业有限公司，在浙江省企业自行监测平台上数据显示，其COD数据显示连续多日超标排放，请 @浙江环保 @杭州环保 @富阳环保 给予说明。 @绿色江南公众环境关注中心 @蔚蓝地图#蔚蓝地图# @PECC-LiJ ​,0,2,44,2016-11-17 10:18:21,https://weibo.cn/comment/EhW0mbri3?uid=5907562386&rl=1#cmtfrm,富阳钓鱼实业,,,,@浙江环保,@杭州环保,@富阳环保,@绿色江南公众环境关注中心,@蔚蓝地图,3
亮剑-老兵汇,我正在申请微博认证，认证信息为“武汉钢铁集团公司职员”。请@简安然 @就是实在 @献血者 @美食达人老王 @心媛-船长9号 @美食俊俊 转发此条微博帮我确认身份，多谢！！ 申请微博认证 ​,0,1,1,2016-09-30 12:43:09,https://weibo.cn/comment/EaErim0fv?uid=1980367850&rl=1#cmtfrm,武汉钢铁（集团）公司,,,,@简安然,@就是实在,@献血者,@美食达人老王,@心媛-船长9号,@美食俊俊,1
居里屋HIT,2016年04月26日09点，哈尔滨市华能集中供热有限公司在线监测数据，希望排放浓度高的企业作出公开说明！二期一号超标11倍，二期二号超标12倍[喵喵]咋不上天呢#蔚蓝地图##哈尔滨空气污染#@冰城人士 @哈尔滨空气质量天天报 ​,0,0,0,2016-04-26 09:53:42,https://weibo.cn/comment/DsIGSsClJ?uid=5757467379&rl=1#cmtfrm,哈尔滨市华能集中供热,,,,@冰城人士,@哈尔滨空气质量天天报,1
PECC-LN,宜兴市建邦环境投资有限责任公司和桥污水处理厂 ，在江苏省企业自行监测平台上数据显示，其氨氮数据连续多日超标排放。请 @江苏环保 @宜兴环保 给予说明。@绿色江南公众环境关注中心 @蔚蓝地图#蔚蓝地图# @PECC-LiJ ​,0,1,1,2016-11-21 13:48:21,https://weibo.cn/comment/Eiz5Ar4jK?uid=5907562386&rl=1#cmtfrm,宜兴市建邦环境投资,,,,@江苏环保,@宜兴环保,@绿色江南公众环境关注中心,@蔚蓝地图,1
PECC-LN,德清县新市乐安污水处理厂，在浙江省企业自行监测平台上数据显示，其COD数据显示连续多日超标排放，请 @浙江环保 @湖州环保 给予说明。 @绿色江南公众环境关注中心 @蔚蓝地图#蔚蓝地图# @PECC-YR ​,0,3,22,2016-11-07 09:54:28,https://weibo.cn/comment/EgpzHgXUC?uid=5907562386&rl=1#cmtfrm,德清县新市乐安污水处理厂,,,,@浙江环保,@湖州环保,@绿色江南公众环境关注中心,@蔚蓝地图,2
PECC-LN,德清县新市乐安污水处理厂，在浙江省企业自行监测平台上数据显示，其COD数据显示间断性超标排放，请 @环保部发布 关注，请 @浙江环保 @湖州环保 @德清环保 给予说明。 @绿色江南公众环境关注中心 @蔚蓝地图#蔚蓝地图# @PECC-LiJ ​,0,4,14,2016-12-05 16:23:15,https://weibo.cn/comment/EkI5pi00Y?uid=5907562386&rl=1#cmtfrm,德清县新市乐安污水处理厂,,,,@环保部发布,@浙江环保,@湖州环保,@德清环保,@绿色江南公众环境关注中心,@蔚蓝地图,3
蔚蓝地图,清县新市乐安污水处理厂，在浙江省企业自行监测平台上数据显示，其COD数据显示连续多日超标排放，请 @浙江环保 @湖州环保 给予说明。 @绿色江南公众环境关注中心 @蔚蓝地图#蔚蓝地图# @PECC-YR ​,1,3,20,2016-11-07 10:01:33,https://weibo.cn/comment/EgpzHgXUC?rl=1#cmtfrm,德清县新市乐安污水处理厂,1,PECC-LN,转发理由:希望排放浓度高的德清县新市乐安污水处理厂作出公开说明！@德清环保 @浙江环境观察 @公众环境马军      ,@浙江环保,@湖州环保,@绿色江南公众环境关注中心,@蔚蓝地图,@德清环保,@浙江环境观察,@公众环境马军,3
PECC-LN,德清县新市乐安污水处理厂，在浙江省企业自行监测平台上数据显示，其COD数据显示连续多日超标排放，请 @浙江环保 @湖州环保 给予说明。 @绿色江南公众环境关注中心 @蔚蓝地图#蔚蓝地图# @PECC-YR ​,0,3,22,2016-11-07 09:54:28,https://weibo.cn/comment/EgpzHgXUC?uid=5907562386&rl=1#cmtfrm,德清县新市乐安污水处理厂,,,,@浙江环保,@湖州环保,@绿色江南公众环境关注中心,@蔚蓝地图,2
河南省旅游协会,【宝丰县旅游局召开申报“中国河南知名旅游商品”动员会】为进一步推动宝丰县旅游商品的发展，提升旅游商品的知名度和美誉度，依据省市文件精神，根据郜县长的批示，12月5日下午，宝丰县旅游局在县文管委三楼会议室召开关于申报“中国河南知名旅游商品”动员会，宝丰宋宫汝瓷、宝丰酒业、买根烧鸡、冯异醋业、石磨房、观音堂花椒协会及伊利乳业等17家商户参加会议。     据悉，会议由旅游局副局长吕辉主持，旅游局副局长李书歌对申报的具体事宜进行了详细的解释说明，并指出，我县旅游商品虽然丰富，但缺少文化性、艺术性，市场需要开发富有特色的旅游纪念品，增强对游客的吸引力，促进旅游产业与其他产业融合发展，结合我县实际，突出“特、新、精、美”四个字，生产出游客买得到、买得起、值得买、愿意买的旅游商品，推进宝丰旅游商品创新发展，提升宝丰旅游知名度和影响力。     最后，县汝瓷局副局长胡巧芳要求参加会议的汝瓷代表们一定要高度重视，严格按照文件要求申报，体现出宝丰汝瓷的特色。@郑州旅游局 @开封市旅游局 @洛阳市旅发委 @新乡旅游微博 @焦作市旅游局 @信阳市旅游局 @平顶山旅游局 @南阳市旅游和外事侨务局 @商丘市旅游局 @濮阳市旅游局 @漯河旅游 @周口市旅游管理部门 @河南济源旅游 @驻马店旅游局 @清风鹤壁旅游 @三门峡旅游微博@河南旅游新生活杂志 @河南旅游,0,0,0,2016-12-09 07:45:28,https://weibo.cn/comment/Elgpe5QDz?uid=5131910422&rl=1#cmtfrm,宝丰酒业,,,,@郑州旅游局,@开封市旅游局,@洛阳市旅发委,@新乡旅游微博,@焦作市旅游局,@信阳市旅游局,@平顶山旅游局,@南阳市旅游和外事侨务局,@商丘市旅游局,@濮阳市旅游局,@漯河旅游,@周口市旅游管理部门,@河南济源旅游,@驻马店旅游局,@清风鹤壁旅游,@三门峡旅游微博,@河南旅游新生活杂志,@河南旅游,14
PECC_JJW,江苏省国家重点监控企业自行监测信息发布平台显示，中国石化集团南京化学工业有限公司连云港碱厂 氮氧化物连续超标多日，请@港城环保 @江苏环保 关注！@绿色江南方应君 @绿色江南公众环境关注中心 ​,0,0,2,2016-06-14 11:38:40,https://weibo.cn/comment/DAbjPr9oT?uid=5812328042&rl=1#cmtfrm,中国石化集团南京化学工业,,,,@港城环保,@江苏环保,@绿色江南方应君,@绿色江南公众环境关注中心,2
花子风0916,2016年01月08日10点，中国石化集团南京化学工业有限公司连云港碱厂在线监测数据，希望排放浓度高的企业作出公开说明！#蔚蓝地图#已经多次提醒@江苏环保 均为见到回应@蔚蓝地图  ​,0,0,0,2016-01-08 10:32:48,https://weibo.cn/comment/Dc9mDeNRA?uid=2611339491&rl=1#cmtfrm,中国石化集团南京化学工业,,,,@江苏环保,@蔚蓝地图,1
花子风0916,2016年01月03日16点，中国石化集团南京化学工业有限公司连云港碱厂在线监测数据，希望排放浓度高的企业作出公开说明！#蔚蓝地图#已经多次提醒@江苏环保 @连云港空气环境检测中心 @连云港经济技术开发区环保局 均未做出任何回答@环保重案六组 @好空气保卫侠 @绿色中国年度人物 @石化实说  ​,0,0,1,2016-01-03 16:53:18,https://weibo.cn/comment/DbqIArGMQ?uid=2611339491&rl=1#cmtfrm,中国石化集团南京化学工业,,,,@江苏环保,@连云港空气环境检测中心,@连云港经济技术开发区环保局,@环保重案六组,@好空气保卫侠,@绿色中国年度人物,@石化实说,3
_SpiritLee_,2016年03月24日10点，广州珠江电力有限公司在线监测数据，希望排放浓度高的企业作出公开说明！#蔚蓝地图#@广州环保 ​,0,0,0,2016-03-24 10:34:09,https://weibo.cn/comment/DnHQV5A5K?uid=1726123725&rl=1#cmtfrm,广州珠江电力,,,,@广州环保,1
广东水污染地图,2016年02月27日22点，广州珠江电力有限公司在线监测数据，希望排放浓度高的企业作出公开说明！#蔚蓝地图#@广州环保 @南粤绿声 @深圳市绿源环保志愿者协会 ​,0,0,0,2016-02-27 22:31:06,https://weibo.cn/comment/DjPr0DXV1?uid=5203358304&rl=1#cmtfrm,广州珠江电力,,,,@广州环保,@南粤绿声,@深圳市绿源环保志愿者协会,1
石臼街道幸福社区,希望日照亚太森博浆纸（木浆厂）不要如此猖狂，6月16日下午又大肆排放，有着让人窒息刺鼻的气味，连新市区都能闻到。真觉得是罚罚款就能了事？这样下去真就没人管？@日照环境 @山东环境 有关部门我们等着看，不要解释，要的是一个公道。 ​,2,0,1,2016-06-16 19:36:07,https://weibo.cn/comment/DAxiBy8px?uid=2606609144&rl=1#cmtfrm,亚太森博（山东）浆纸,,,,@日照环境,@山东环境,2
日照新财经,"#日照身边事#【森博浆纸公司异味溢出】@日照环境 消息,今天上午市区出现大面积“烂白菜帮子”味,环保监察人员及时排查,锁定异味源为木桨厂。@亚太森博山东浆纸 上午11:26发布致歉声明：9时50分,我公司二期项目碱回收炉因设备故障跳停,导致部分异味溢出,对市区造成了一定影响,对此我们深表歉意。 ​",1,0,2,2016-04-12 15:43:24,https://weibo.cn/comment/DqCZS6tOT?uid=5763081759&rl=1#cmtfrm,亚太森博（山东）浆纸,,,,@日照环境,@亚太森博山东浆纸,1
LLe_银川航拍,2013年开始举报到现在2016年7月，刺鼻的味道不但没有得到解决，反而从以前只有晚上偷排到现在整个白天也臭。我们老百姓不知道政府领导部门是不是在贿赂，@银川生活 @问政银川 @永宁环保 @银川晚报 @银川日报 @直播银川 @CCTV焦点访谈 @银川发布 @中国环境新闻 @中国城市空气污染排行 @蔚蓝地图 ​,0,8,0,2016-07-06 19:22:22,https://weibo.cn/comment/DDySYBjol?rl=1#cmtfrm,宁夏多维药业,1,LLe_银川航拍,转发理由:宁夏银川市，永宁县，望远镇，北边泰瑞药业(以前多维药业)。南边启元药业，以前只有晚上偷排的时候会臭的不敢开窗户。现在白天也肆无忌惮的排放。给相关部门不止一次打电话举报，从2013年就说已经在处理排污问题，到现在2016年7月。任然没有丝毫变化。给我们健康的居住环境，给我们吸点我无味的氧气吧      ,@银川生活,@问政银川,@永宁环保,@银川晚报,@银川日报,@直播银川,@银川发布,@中国环境新闻,@中国城市空气污染排行,@蔚蓝地图,2
LLe_银川航拍,2013年开始举报到现在2016年7月，刺鼻的味道不但没有得到解决，反而从以前只有晚上偷排到现在整个白天也臭。我们老百姓不知道政府领导部门是不是在贿赂，@银川生活 @问政银川 @永宁环保 @银川晚报 @银川日报 @直播银川 @CCTV焦点访谈 @银川发布 @中国环境新闻 @中国城市空气污染排行 @蔚蓝地图 ​,0,8,1,2016-07-06 17:16:10,https://weibo.cn/comment/DDySYBjol?rl=1#cmtfrm,宁夏多维药业,1,LLe_银川航拍,转发理由:宁夏银川市，永宁县，望远镇，北边泰瑞药业(以前多维药业)。南边启元药业，以前只有晚上偷排的时候会臭的不敢开窗户。现在白天也肆无忌惮的排放。给相关部门不止一次打电话举报，从2013年就说已经在处理排污问题，到现在2016年7月。任然没有丝毫变化。给我们健康的居住环境，给我们吸点我无味的氧气吧      ,@银川生活,@问政银川,@永宁环保,@银川晚报,@银川日报,@直播银川,@银川发布,@中国环境新闻,@中国城市空气污染排行,@蔚蓝地图,2
LLe_银川航拍,2013年开始举报到现在2016年7月，刺鼻的味道不但没有得到解决，反而从以前只有晚上偷排到现在整个白天也臭。我们老百姓不知道政府领导部门是不是在贿赂，@银川生活 @问政银川 @永宁环保 @银川晚报 @银川日报 @直播银川 @CCTV焦点访谈 @银川发布 @中国环境新闻 @中国城市空气污染排行 @蔚蓝地图 ​,0,8,2,2016-07-06 17:15:30,https://weibo.cn/comment/DDySYBjol?rl=1#cmtfrm,宁夏多维药业,1,LLe_银川航拍,转发理由:宁夏银川市，永宁县，望远镇，北边泰瑞药业(以前多维药业)。南边启元药业，以前只有晚上偷排的时候会臭的不敢开窗户。现在白天也肆无忌惮的排放。给相关部门不止一次打电话举报，从2013年就说已经在处理排污问题，到现在2016年7月。任然没有丝毫变化。给我们健康的居住环境，给我们吸点我无味的氧气吧      ,@银川生活,@问政银川,@永宁环保,@银川晚报,@银川日报,@直播银川,@银川发布,@中国环境新闻,@中国城市空气污染排行,@蔚蓝地图,2
民间垃圾焚烧,#污染源在线监测公开# 创冠环保（福清）有限公司在福建省污染源企业自行监测数据发布平台上没有自动监测数据、年度监测报告缺失、手工监测数据严重延迟（最新的是2015年12月检测）、没有停产说明，这是咋了呢？@福州环保 @福建省环保志愿者协会 @厦门绿十字 @毛达1977 详见：http://t.cn/R5GaVSu ​,0,0,2,2016-06-03 16:06:53,https://weibo.cn/comment/Dyxne1Ci7?uid=1865115787&rl=1#cmtfrm,创冠环保（福清）,,,,@福州环保,@福建省环保志愿者协会,@厦门绿十字,@毛达1977,1
塞外游侠,#内蒙古全记录# #呼和浩特全记录# [吃惊]【呼和浩特曾经的污染大户阜丰味精发生发酵缸撑破事故】8月6日23时12分，内蒙古阜丰生物科技有限公司麸酸二厂生产线在停产检修后再启动试压过程中罐体撑裂，产生的气流造成车间钢结构墙体及部分玻璃损坏，当时，现场有6名工作人员，其中4人不同程度被残片划伤，两人经包扎处理后离开医院，另两人留院观察。[白眼]@内蒙古晨报 @呼和浩特发布 @点击内蒙古 @掌上内蒙古 @呼市每日最新闻 @呼和浩特金川工业园区 @牧野硕硕 @头条峰言 @内蒙古综合新闻网 @内蒙古小编 @张克伟 @内蒙古王国柱 @呼和浩特城事儿 @轻熟素颜,1,11,17,2016-08-07 21:49:14,https://weibo.cn/comment/E2uW94SZF?uid=1649229124&rl=1#cmtfrm,内蒙古阜丰生物科技,,,,@内蒙古晨报,@呼和浩特发布,@点击内蒙古,@掌上内蒙古,@呼市每日最新闻,@呼和浩特金川工业园区,@牧野硕硕,@头条峰言,@内蒙古综合新闻网,@内蒙古小编,@张克伟,@内蒙古王国柱,@呼和浩特城事儿,@轻熟素颜,1
银川市场监管,#基层动态# 近日，西夏分局组织执法人员、计量专家成立联合检查组，深入辖区重点耗能单位--宁夏电投西夏热电有限公司和宁夏制钠厂等企业，开展能源计量监督检查。       此次检查，依据《银川市市场监管局关于印发2016年度能源计量监督检查实施方案的通知》（银市场监管发〔2016〕214号）文件要求，按照“重点用能单位能源计量检查记录”规定条文，一查能源计量管理；二查能源计量人员；三查能源计量器具；四查能源计量数据管理。同时，积极帮助各单位查找能源有效利用中，计量管理方面存在的不足之处，督促其严格落实能源计量主体责任，强化能源计量档案的建档分类管理。       辖区共20家重点用能单位，2家停产，根据市局要求西夏区监督抽查率达35%以上，共监督检查7家企业，对个别企业能源计量器具配备率达不到规定要求、少数能源计量器具准确度等级较低的问题，责令企业限期改正。@西夏市场监管,3,1,0,2016-11-24 14:30:20,https://weibo.cn/comment/Ej1E75wDu?uid=1975923223&rl=1#cmtfrm,宁夏电投西夏热电,,,,@西夏市场监管,1
银川环境监察,@Safiyyah1  关于宁夏电投西夏热电有限公司排放废气一事，经我部门调查已形成正式结果，请阅。@问政银川 @银川环保 ​,1,1,0,2016-04-01 17:55:46,https://weibo.cn/comment/DoYa8rhnt?uid=2316615472&rl=1#cmtfrm,宁夏电投西夏热电,,,,@问政银川,@银川环保,2
龙岗发电运行,【荣耀时刻】近期，许昌龙岗发电频传喜报：尹高旭获得全国总工会“五一劳动奖章”，炉控班获得河南省“工人先锋号”，二期二值获得许昌市“工人先锋号”等称号，踏实肯干勇攀高峰，匠心精神助力安全生产，为集团公司争得荣誉。为他们点赞！@共青团许昌市委 @美丽大唐 @文明许昌 @都市报道 @许昌晨报 ​,0,0,0,2016-05-05 14:08:48,https://weibo.cn/comment/Du7cTmi8K?uid=3515211522&rl=1#cmtfrm,许昌龙岗发电,,,,@共青团许昌市委,@美丽大唐,@文明许昌,@都市报道,@许昌晨报,1
CL布伦希尔德,@吉林省环境保护厅 2016年01月25日13点，吉林成大弘晟能源有限公司热电分公司在线监测数据，希望排放浓度高的企业作出公开说明！#蔚蓝地图# ​,0,0,0,2016-01-25 13:51:31,https://weibo.cn/comment/DeKVJ80Qo?uid=1581013094&rl=1#cmtfrm,吉林成大弘晟能源,,,,@吉林省环境保护厅,1
PECC-LN,无锡永达污水处理有限公司(二期），在江苏省企业自行监测平台上数据显示，其COD数据显示连续多日超标排放。请 @江苏环保 @无锡环保 给予说明。@绿色江南公众环境关注中心 @蔚蓝地图#蔚蓝地图# @PECC_YR ​,0,0,0,2016-11-10 17:15:51,https://weibo.cn/comment/EgUKlntJ1?uid=5907562386&rl=1#cmtfrm,无锡永达污水处理,,,,@江苏环保,@无锡环保,@绿色江南公众环境关注中心,@蔚蓝地图,2
吉林大米好吃的大米,长春身边事#长春燃气股份有限公司领导：天这么冷，做饭没气怎么办、靠燃气供暖的用户咋办？[泪][泪][泪][泪][泪][泪]。生态大街与天富路交汇处管网被第三方昨天施工弄坏了，抢修需要这么长时间下周才能供气么？没有应急预案么？请公开你们应急处置情况？持续跟踪关注！ ​,0,2,0,2016-11-05 07:30:52,https://weibo.cn/comment/Efx0u7Mj6?rl=1#cmtfrm,长春燃气股份,1,吉林大米好吃的大米,转发理由:#长春身边事#停气进入第6天，[泪][泪][泪][泪][泪][泪] //长春燃气股份有限公司领导：就因为管子弄坏了，造成6天了还没供气。既然你们知道一楼住户关阀门困难，为什么去年不把开关安装在室外？如果领导住在此小区你们多长时间供气？@央视新闻 @吉林电视台 @长春能见度_政务公开办公室       ,@央视新闻,@吉林电视台,@长春能见度_政务公开办公室,1
PECC-LN,洛川县污水处理厂，在陕西省国家重点监控企业监测信息发布平台上数据显示，其氨氮数据显示间断性超标排放，请 @环保部发布 关注，请 @陕西环保 @延安市环境保护局 给予说明。@绿色江南公众环境关注中心 @蔚蓝地图 #蔚蓝地图# @PECC-LiJ ​,0,2,7,2016-12-02 09:39:34,https://weibo.cn/comment/Ekda44ZXS?uid=5907562386&rl=1#cmtfrm,洛川县污水处理厂,,,,@环保部发布,@陕西环保,@延安市环境保护局,@绿色江南公众环境关注中心,@蔚蓝地图,2
blueromance,东达集团包头水务有限公司在线监测数据，希望排放浓度高的企业作出公开说明，2016年10月19日21点 。#蔚蓝地图#http://t.cn/RVoUhhu @内蒙古环保联合会 @公众环境马军 @包头市生态环境保护协会 @包头环保 @蔚蓝地图 @包头市环保局昆区分局 ​,0,0,0,2016-10-19 20:27:02,https://weibo.cn/comment/EdAB1m21f?uid=1812276377&rl=1#cmtfrm,东达集团包头水务,,,,@内蒙古环保联合会,@公众环境马军,@包头市生态环境保护协会,@包头环保,@蔚蓝地图,@包头市环保局昆区分局,1
水魏记,江苏埭头综合污水处理有限公司 ，在江苏省企业自行监测平台上数据显示，其COD、氨氮和总磷数据已连续多日超标排放，从3月份开始一直超标不断！请 @常州环保局 @溧阳环保 关注。@PECC_ZLY @绿色江南公众环境关注中心 @蔚蓝地图 ​,0,3,1,2016-03-22 12:31:32,https://weibo.cn/comment/DnpLzqy6z?uid=2858577952&rl=1#cmtfrm,江苏埭头综合污水处理,,,,@常州环保局,@溧阳环保,@绿色江南公众环境关注中心,@蔚蓝地图,2
PECC-LN,上海金兴水处理工程有限公司，在上海市重点监控企业自行监测信息发布平台显示，其COD数据显示连续多日超标排放 。请 @环保部发布 关注，请 @上海环境 给予说明。@绿色江南公众环境关注中心 @蔚蓝地图#蔚蓝地图# @PECC-LiJ @PECC-米菲 ​,0,0,1,2016-12-29 14:42:12,https://weibo.cn/comment/EolGjgmDD?uid=5907562386&rl=1#cmtfrm,上海金兴水处理工程,,,,@环保部发布,@上海环境,@绿色江南公众环境关注中心,@蔚蓝地图,1
PECC-LN,绍兴东龙针纺织印染有限公司，在浙江省企业自行监测平台上数据显示，其COD数据显示连续多日超标排放，请 @浙江环保 @绍兴-环保   关注。 @绿色江南公众环境关注中心 @蔚蓝地图#蔚蓝地图# @PECC-YR ​,0,2,21,2016-09-21 13:42:26,https://weibo.cn/comment/E9hYTgTNy?uid=5907562386&rl=1#cmtfrm,绍兴东龙针纺织印染,,,,@浙江环保,@绍兴-环保,@绿色江南公众环境关注中心,@蔚蓝地图,2
